{
  "$id": "Enbs9f3VtP6w_X2LOXax26FaW93Sp3Imv0hUdUk8E9HU",
  "$schema": "http://json-schema.org/draft-07/schema#",
  "title": "Qualified vLEI Issuer Credential",
  "description": "A vLEI Credential issued by GLEIF to Qualified vLEI Issuers which allows the Qualified vLEI Issuers to issue, verify and revoke Legal Entity vLEI Credentials and Legal Entity Official Organizational Role vLEI Credentials",
  "credentialType": "QualifiedvLEIIssuervLEICredential",
  "properties": {
    "v": {
      "type": "string"
    },
    "d": {
      "type": "string"
    },
    "u": {
      "description": "one time use nonce",
      "type": "string"
    },
    "i": {
      "type": "string"
    },
    "ri": {
      "description": "credential status registry",
      "type": "string"
    },
    "s": {
      "description": "schema SAID",
      "type": "string"
    },
    "a": {
      "oneOf": [
        {
          "description": "attribute block SAID",
          "type": "string"
        },
        {
          "description": "attribute block",
          "properties": {
            "d": {
              "type": "string"
            },
            "i": {
              "type": "string"
            },
            "dt": {
              "description": "issuance date time",
              "format": "date-time",
              "type": "string"
            },
            "LEI": {
              "type": "string"
            },
            "gracePeriod": {
              "default": 90,
              "type": "integer"
            }
          },
          "additionalProperties": false,
          "required": [
            "i",
            "dt",
            "LEI"
          ],
          "type": "object"
        }
      ]
    },
    "r": {
      "oneOf": [
        {
          "description": "rules block SAID",
          "type": "string"
        },
        {
          "description": "rules block",
          "type": "object",
          "properties": {
            "d": {
              "type": "string",
              "description": "SAID of rules block"
            },
            "usageDisclaimer": {
              "type": "object",
              "description": "Usage Disclaimer",
              "properties": {
                "l": {
                  "description": "associated legal language",
                  "const": "Usage of a valid Legal Entity vLEI Credential does not assert that the Legal Entity is trustworthy, honest, reputable in its business dealings, safe to do business with, or compliant with any laws."
                }
              }
            },
            "issuanceDisclaimer": {
              "type": "object",
              "description": "Issuance Disclaimer",
              "properties": {
                "l": {
                  "description": "associated legal language",
                  "const": "Issuance of a valid Legal Entity vLEI Credential only establishes that the information in the requirements in the Identity Verification section 6.3 of the Credential Governance Framework were met in accordance with the vLEI Ecosystem Governance Framework."
                }
              }
            }
          },
          "additionalProperties": false,
          "required": [
            "d",
            "usageDisclaimer",
            "issuanceDisclaimer"
          ]
        }
      ]
    },
    "e": {
      "oneOf": [
        {
          "description": "edge block SAID",
          "type": "string"
        },
        {"type": "object"}
      ]
    }
  },
  "additionalProperties": false,
  "required": [
    "i",
    "ri",
    "s",
    "d"
  ],
  "type": "object"
}
