{
  "v": "ACDC10JSON00011c_",
  "d": "EBdXt3gIXOf2BBWNHdSXCJnFJL5OuQPyM5K0neuniccM",
  "i": "did:keri:EmkPreYpZfFk66jpf3uFv7vklXKhzBrAqjsKAn2EDIPM",
  "ri": "did:keri:EymRy7xMwsxUelUauaXtMxTfPAMPAI6FkekwlOjkggt",
  "s": "E46jrVPTzlSkUPqGGeIZ8a8FWS7a6s4reAXRZOkogZ2A",
  "a": {
    "d": "EgveY4-9XgOcLxUderzwLIr9Bf7V_NHwY1lkFrn9y2PY",
    "i": "did:keri:EQzFVaMasUf4cZZBKA0pUbRc9T8yUXRFLyM1JDASYqAA",
    "dt": "2021-06-09T17:35:54.169967+00:00",
    "LEI": "254900OPPU84GM83MG36"
  },
  "e": {
    "d": "EIl3MORH3dCdoFOLe71iheqcywJcnjtJtQIYPvAu6DZA",
    "qvi": {
      "n": "Et2DOOu4ivLsjpv89vgv6auPntSLx4CvOhGUxMhxPS24",
      "s": "EWCeT9zTxaZkaC_3-amV2JtG6oUxNA36sCC0P5MI7Buw"
    }
  },
  "r": {
    "d": "EDIai3Wkd-Z_4cezz9nYEcCK3KNH5saLvZoS_84JL6NU",
    "usageDisclaimer": {
      "l": "Usage of a valid Legal Entity vLEI Credential does not assert that the Legal Entity is trustworthy, honest, reputable in its business dealings, safe to do business with, or compliant with any laws."
    },
    "issuanceDisclaimer": {
      "l": "Issuance of a valid Legal Entity vLEI Credential only establishes that the information in the requirements in the Identity Verification section 6.3 of the Credential Governance Framework were met in accordance with the vLEI Ecosystem Governance Framework."
    }
  }
}
